{
  "$schema": "https://json-schema.org/draft/2020-12/schema",
  "$id": "https://byjtt.com/schemas/control-plane-state.schema.json",
  "title": "AI Game Development Pipeline Control Plane State",
  "type": "object",
  "required": ["schemaVersion", "project", "stages", "gates", "agents", "decisions", "evidence"],
  "properties": {
    "schemaVersion": { "type": "string" },
    "generatedAt": { "type": "string", "format": "date-time" },
    "project": {
      "type": "object",
      "required": ["id", "name", "kind", "lifecycleStage"],
      "properties": {
        "id": { "type": "string" },
        "name": { "type": "string" },
        "kind": { "enum": ["experiment", "game", "pipeline", "benchmark"] },
        "lifecycleStage": { "type": "string" },
        "summary": { "type": "string" },
        "repository": { "type": "string" },
        "latestBuildId": { "type": ["string", "null"] }
      },
      "additionalProperties": true
    },
    "stages": {
      "type": "array",
      "items": {
        "type": "object",
        "required": ["id", "label", "status"],
        "properties": {
          "id": { "type": "string" },
          "label": { "type": "string" },
          "status": {
            "enum": ["unknown", "running", "pass", "warn", "fail", "blocked", "human-required", "stale"]
          },
          "dependsOn": { "type": "array", "items": { "type": "string" } },
          "evidenceIds": { "type": "array", "items": { "type": "string" } },
          "nextAction": { "type": ["string", "null"] }
        },
        "additionalProperties": true
      }
    },
    "gates": {
      "type": "array",
      "items": {
        "type": "object",
        "required": ["id", "label", "kind", "status"],
        "properties": {
          "id": { "type": "string" },
          "label": { "type": "string" },
          "kind": { "enum": ["automated", "human", "mixed"] },
          "status": { "enum": ["pending", "approved", "needs-work", "rejected", "blocked"] },
          "stageId": { "type": "string" },
          "evidenceIds": { "type": "array", "items": { "type": "string" } },
          "verdict": {
            "type": ["object", "null"],
            "properties": {
              "actor": { "type": "string" },
              "decision": { "enum": ["approved", "needs-work", "rejected"] },
              "notes": { "type": "string" },
              "recordedAt": { "type": "string", "format": "date-time" }
            },
            "additionalProperties": false
          }
        },
        "additionalProperties": true
      }
    },
    "agents": {
      "type": "array",
      "items": {
        "type": "object",
        "required": ["id", "role", "status"],
        "properties": {
          "id": { "type": "string" },
          "role": { "type": "string" },
          "status": { "enum": ["idle", "queued", "running", "blocked", "complete", "failed"] },
          "objective": { "type": "string" },
          "stageId": { "type": ["string", "null"] },
          "evidenceIds": { "type": "array", "items": { "type": "string" } }
        },
        "additionalProperties": true
      }
    },
    "decisions": {
      "type": "array",
      "items": {
        "type": "object",
        "required": ["id", "title", "selected"],
        "properties": {
          "id": { "type": "string" },
          "title": { "type": "string" },
          "selected": { "type": "string" },
          "alternatives": { "type": "array", "items": { "type": "string" } },
          "rationale": { "type": "string" },
          "evidenceIds": { "type": "array", "items": { "type": "string" } },
          "reviewAfter": { "type": ["string", "null"], "format": "date" }
        },
        "additionalProperties": true
      }
    },
    "evidence": {
      "type": "array",
      "items": {
        "type": "object",
        "required": ["id", "type", "label", "status"],
        "properties": {
          "id": { "type": "string" },
          "type": { "enum": ["test", "screenshot", "recording", "benchmark", "device-run", "build", "provenance", "analytics", "document", "other"] },
          "label": { "type": "string" },
          "status": { "enum": ["current", "stale", "missing", "failed"] },
          "uri": { "type": ["string", "null"] },
          "revision": { "type": ["string", "null"] },
          "capturedAt": { "type": ["string", "null"], "format": "date-time" }
        },
        "additionalProperties": true
      }
    },
    "builds": {
      "type": "array",
      "items": {
        "type": "object",
        "required": ["id", "label", "status"],
        "properties": {
          "id": { "type": "string" },
          "label": { "type": "string" },
          "status": { "enum": ["queued", "building", "ready", "failed", "superseded"] },
          "target": { "type": "string" },
          "revision": { "type": "string" },
          "launchUri": { "type": ["string", "null"] },
          "evidenceIds": { "type": "array", "items": { "type": "string" } }
        },
        "additionalProperties": true
      }
    }
  },
  "additionalProperties": true
}
